[
  {
    "id": "g001",
    "category": "Kalimat dasar",
    "pattern": "N1 は N2 です",
    "title": "X adalah Y",
    "explanation": "Partikel は menandai topik kalimat dan dibaca “wa”. です menutup kalimat dengan sopan.",
    "examples": [
      {
        "jp": "わたしは がくせいです。",
        "id": "Saya pelajar."
      },
      {
        "jp": "たなかさんは せんせいです。",
        "id": "Tanaka adalah guru."
      }
    ],
    "exercise": {
      "prompt": "わたし___ がくせいです。（topik）",
      "answer": "は",
      "choices": [
        "は",
        "を",
        "に",
        "で"
      ]
    },
    "reviewed": false
  },
  {
    "id": "g002",
    "category": "Kalimat dasar",
    "pattern": "N1 は N2 じゃありません",
    "title": "X bukan Y",
    "explanation": "Bentuk negatif です. Dalam tulisan formal dipakai ではありません.",
    "examples": [
      {
        "jp": "わたしは せんせいじゃありません。",
        "id": "Saya bukan guru."
      },
      {
        "jp": "これは ほんじゃありません。",
        "id": "Ini bukan buku."
      }
    ],
    "exercise": {
      "prompt": "これは ほん___ありません。",
      "answer": "じゃ",
      "choices": [
        "じゃ",
        "を",
        "が",
        "に"
      ]
    },
    "reviewed": false
  },
  {
    "id": "g003",
    "category": "Kalimat dasar",
    "pattern": "〜ですか",
    "title": "Kalimat tanya",
    "explanation": "Tambahkan か di akhir kalimat untuk membuat pertanyaan ya/tidak. Nada naik, tanpa tanda tanya.",
    "examples": [
      {
        "jp": "あなたは がくせいですか。",
        "id": "Apakah Anda pelajar?"
      },
      {
        "jp": "おげんきですか。",
        "id": "Apa kabar?"
      }
    ],
    "exercise": {
      "prompt": "これは ほんです___。（bertanya）",
      "answer": "か",
      "choices": [
        "か",
        "ね",
        "よ",
        "を"
      ]
    },
    "reviewed": false
  },
  {
    "id": "g004",
    "category": "Kalimat dasar",
    "pattern": "N も",
    "title": "Juga",
    "explanation": "も menggantikan は/が/を bila hal yang sama berlaku untuk topik lain.",
    "examples": [
      {
        "jp": "わたしも がくせいです。",
        "id": "Saya juga pelajar."
      },
      {
        "jp": "ともだちも コーヒーを のみます。",
        "id": "Teman saya juga minum kopi."
      }
    ],
    "exercise": {
      "prompt": "わたし___ にほんごを べんきょうします。（saya juga）",
      "answer": "も",
      "choices": [
        "も",
        "を",
        "に",
        "で"
      ]
    },
    "reviewed": false
  },
  {
    "id": "g005",
    "category": "Kalimat dasar",
    "pattern": "N1 の N2",
    "title": "Kepunyaan / hubungan",
    "explanation": "の menghubungkan dua kata benda: pemilik, asal, atau keterangan.",
    "examples": [
      {
        "jp": "これは わたしの ほんです。",
        "id": "Ini bukuku."
      },
      {
        "jp": "にほんごの せんせいです。",
        "id": "Dia guru bahasa Jepang."
      }
    ],
    "exercise": {
      "prompt": "これは わたし___ かばんです。",
      "answer": "の",
      "choices": [
        "の",
        "を",
        "が",
        "も"
      ]
    },
    "reviewed": false
  },
  {
    "id": "g006",
    "category": "Kalimat dasar",
    "pattern": "これ・それ・あれ",
    "title": "Ini / itu / itu (jauh)",
    "explanation": "これ dekat pembicara, それ dekat lawan bicara, あれ jauh dari keduanya. どれ = yang mana.",
    "examples": [
      {
        "jp": "これは ほんです。",
        "id": "Ini buku."
      },
      {
        "jp": "あれは えきです。",
        "id": "Itu (di sana) stasiun."
      }
    ],
    "exercise": {
      "prompt": "___は わたしの ペンです。（benda di tangan saya）",
      "answer": "これ",
      "choices": [
        "これ",
        "それ",
        "あれ",
        "どれ"
      ]
    },
    "reviewed": false
  },
  {
    "id": "g007",
    "category": "Kalimat dasar",
    "pattern": "この・その・あの + N",
    "title": "Ini / itu + benda",
    "explanation": "Menerangkan kata benda: この dekat saya, その dekat Anda, あの jauh.",
    "examples": [
      {
        "jp": "この ほんは おもしろいです。",
        "id": "Buku ini menarik."
      },
      {
        "jp": "あの ひとは せんせいです。",
        "id": "Orang itu (di sana) guru."
      }
    ],
    "exercise": {
      "prompt": "___ ひとは せんせいです。（orang yang jauh dari kita berdua）",
      "answer": "あの",
      "choices": [
        "この",
        "その",
        "あの",
        "どの"
      ]
    },
    "reviewed": false
  },
  {
    "id": "g008",
    "category": "Kalimat dasar",
    "pattern": "ここ・そこ・あそこ・どこ",
    "title": "Tempat",
    "explanation": "ここ (di sini), そこ (di situ), あそこ (di sana), どこ (di mana).",
    "examples": [
      {
        "jp": "トイレは あそこです。",
        "id": "Toilet ada di sana."
      },
      {
        "jp": "えきは どこですか。",
        "id": "Stasiun di mana?"
      }
    ],
    "exercise": {
      "prompt": "えきは ___ですか。（bertanya tempat）",
      "answer": "どこ",
      "choices": [
        "どこ",
        "だれ",
        "なに",
        "いつ"
      ]
    },
    "reviewed": false
  },
  {
    "id": "g009",
    "category": "Kalimat dasar",
    "pattern": "だれ・なに(なん)",
    "title": "Siapa / apa",
    "explanation": "だれ untuk orang, なに/なん untuk benda. なん dipakai sebelum です, の, dan kata berawalan t/d/n.",
    "examples": [
      {
        "jp": "あの ひとは だれですか。",
        "id": "Siapa orang itu?"
      },
      {
        "jp": "これは なんですか。",
        "id": "Ini apa?"
      }
    ],
    "exercise": {
      "prompt": "これは ___ですか。（bertanya benda）",
      "answer": "なん",
      "choices": [
        "なん",
        "だれ",
        "どこ",
        "いつ"
      ]
    },
    "reviewed": false
  },
  {
    "id": "g010",
    "category": "Kalimat dasar",
    "pattern": "N に あります／います",
    "title": "Ada (benda / makhluk hidup)",
    "explanation": "あります untuk benda mati, います untuk orang dan hewan. Lokasi ditandai に.",
    "examples": [
      {
        "jp": "つくえの うえに ほんが あります。",
        "id": "Ada buku di atas meja."
      },
      {
        "jp": "にわに ねこが います。",
        "id": "Ada kucing di halaman."
      }
    ],
    "exercise": {
      "prompt": "こうえんに ひとが ___。",
      "answer": "います",
      "choices": [
        "います",
        "あります",
        "です",
        "ます"
      ]
    },
    "reviewed": false
  },
  {
    "id": "g011",
    "category": "Partikel",
    "pattern": "N が あります／います",
    "title": "Subjek keberadaan",
    "explanation": "が menandai hal yang ada (informasi baru).",
    "examples": [
      {
        "jp": "へやに テレビが あります。",
        "id": "Di kamar ada TV."
      },
      {
        "jp": "ここに ほんが あります。",
        "id": "Di sini ada buku."
      }
    ],
    "exercise": {
      "prompt": "ここに ほん___ あります。",
      "answer": "が",
      "choices": [
        "が",
        "を",
        "の",
        "で"
      ]
    },
    "reviewed": false
  },
  {
    "id": "g012",
    "category": "Partikel",
    "pattern": "N を V",
    "title": "Objek langsung",
    "explanation": "を (dibaca “o”) menandai objek kata kerja.",
    "examples": [
      {
        "jp": "パンを たべます。",
        "id": "Saya makan roti."
      },
      {
        "jp": "テレビを みます。",
        "id": "Saya menonton TV."
      }
    ],
    "exercise": {
      "prompt": "みず___ のみます。",
      "answer": "を",
      "choices": [
        "を",
        "が",
        "に",
        "で"
      ]
    },
    "reviewed": false
  },
  {
    "id": "g013",
    "category": "Partikel",
    "pattern": "N に いきます／きます／かえります",
    "title": "Tujuan perjalanan",
    "explanation": "に menandai tujuan gerakan. へ (dibaca “e”) juga bisa dipakai.",
    "examples": [
      {
        "jp": "がっこうに いきます。",
        "id": "Saya pergi ke sekolah."
      },
      {
        "jp": "うちに かえります。",
        "id": "Saya pulang ke rumah."
      }
    ],
    "exercise": {
      "prompt": "がっこう___ いきます。",
      "answer": "に",
      "choices": [
        "に",
        "を",
        "で",
        "と"
      ]
    },
    "reviewed": false
  },
  {
    "id": "g014",
    "category": "Partikel",
    "pattern": "N へ",
    "title": "Arah (dibaca “e”)",
    "explanation": "へ menekankan arah, ditulis へ tetapi dibaca “e”.",
    "examples": [
      {
        "jp": "とうきょうへ いきます。",
        "id": "Saya pergi ke Tokyo."
      },
      {
        "jp": "にほんへ きました。",
        "id": "Saya datang ke Jepang."
      }
    ],
    "exercise": {
      "prompt": "とうきょう___ いきます。（arah）",
      "answer": "へ",
      "choices": [
        "へ",
        "を",
        "が",
        "も"
      ]
    },
    "reviewed": false
  },
  {
    "id": "g015",
    "category": "Partikel",
    "pattern": "N で V (tempat)",
    "title": "Tempat berlangsungnya aksi",
    "explanation": "で menandai tempat suatu kegiatan dilakukan.",
    "examples": [
      {
        "jp": "としょかんで べんきょうします。",
        "id": "Saya belajar di perpustakaan."
      },
      {
        "jp": "レストランで ごはんを たべます。",
        "id": "Saya makan di restoran."
      }
    ],
    "exercise": {
      "prompt": "レストラン___ ごはんを たべます。",
      "answer": "で",
      "choices": [
        "で",
        "を",
        "が",
        "の"
      ]
    },
    "reviewed": false
  },
  {
    "id": "g016",
    "category": "Partikel",
    "pattern": "N で V (alat / cara)",
    "title": "Alat atau cara",
    "explanation": "で juga menandai alat, bahan, atau kendaraan.",
    "examples": [
      {
        "jp": "バスで いきます。",
        "id": "Saya pergi naik bus."
      },
      {
        "jp": "はしで たべます。",
        "id": "Saya makan dengan sumpit."
      }
    ],
    "exercise": {
      "prompt": "えんぴつ___ かきます。（pakai pensil）",
      "answer": "で",
      "choices": [
        "で",
        "を",
        "が",
        "の"
      ]
    },
    "reviewed": false
  },
  {
    "id": "g017",
    "category": "Partikel",
    "pattern": "N と",
    "title": "Dengan / dan",
    "explanation": "と menandai teman bertindak atau menyambung daftar benda.",
    "examples": [
      {
        "jp": "ともだちと えいがを みます。",
        "id": "Saya menonton film dengan teman."
      },
      {
        "jp": "ほんと ノートを かいます。",
        "id": "Saya membeli buku dan buku catatan."
      }
    ],
    "exercise": {
      "prompt": "ともだち___ いきます。（bersama teman）",
      "answer": "と",
      "choices": [
        "と",
        "を",
        "が",
        "で"
      ]
    },
    "reviewed": false
  },
  {
    "id": "g018",